{
  "id": "ambig-002",
  "title": "Orchestrator ignores boundaries and creates agents",
  "body": "The Orchestrator sometimes ignores boundaries and creates additional agents. Or maybe it's the prompts that are too loose. Not sure if this is a prompt issue, a schema issue, or an orchestration issue. It just keeps happening.",
  "source": "examples/vague_tickets.md#4",
  "createdAt": "2026-03-08T00:00:00.000Z"
}
