{
  "id": "ambig-001",
  "title": "Gym should be reusable across repos",
  "body": "We want the Gym to be more reusable across other repositories. It should work for different projects, not just this one. Maybe make it a package or template or something.",
  "source": "examples/vague_tickets.md#9",
  "createdAt": "2026-03-08T00:00:00.000Z"
}
