{
  "id": "solution-001",
  "title": "Add a dashboard to track agent performance",
  "body": "Build a React dashboard that shows agent run history, scores, and failure rates. Use charts to visualize trends over time. Add filters by phase and agent type.",
  "source": "synthetic",
  "createdAt": "2026-03-08T00:00:00.000Z"
}
